{
  "schemaVersion": 2,
  "enterpriseId": "replace-enterprise-id",
  "businessProjectId": "20260729-101-replace-business-project",
  "taskId": "20260729-101-organization-runtime",
  "planVersion": 1,
  "primarySkill": "talent-allocation",
  "status": "planning",
  "revision": 1,
  "currentStageId": "context-lock",
  "checkpoint": null,
  "failureCounts": {},
  "createdAt": "2026-07-29T00:00:00.000Z",
  "updatedAt": "2026-07-29T00:00:00.000Z"
}
